{
  "as_of": "2026-09-25T09:30:00Z",
  "complete": true,
  "entries": [
    {
      "blake3": "vHHFGXYJXEoRBvRf9XFK390/Dz5c1ZZkPuirW5KXjq8=",
      "kind": "profile",
      "refs": [
        "https://dana-prints.example"
      ],
      "seq": "1",
      "uri": "pubky://pz6c7qywejnprcr9ixrscfpm88mxjxjx8kgpurk5qsx657i81mco/pub/pubky.app/profile.json"
    },
    {
      "blake3": "L2s2nUkyXMTAohW9csEr1eOyYMT2sr7b/VIQshNwPX8=",
      "kind": "blob",
      "seq": "2",
      "uri": "pubky://pz6c7qywejnprcr9ixrscfpm88mxjxjx8kgpurk5qsx657i81mco/pub/pubky.app/blobs/5XNKD7A969EC9G522PYQ5G9BTM"
    },
    {
      "blake3": "4Tq8MKbrZn0KnUWCFYvjJjHoLczbKJLq/Pto46Tzcfk=",
      "kind": "file",
      "refs": [
        "pubky://pz6c7qywejnprcr9ixrscfpm88mxjxjx8kgpurk5qsx657i81mco/pub/pubky.app/blobs/5XNKD7A969EC9G522PYQ5G9BTM"
      ],
      "seq": "3",
      "uri": "pubky://pz6c7qywejnprcr9ixrscfpm88mxjxjx8kgpurk5qsx657i81mco/pub/pubky.app/files/0035R99S1P940"
    },
    {
      "blake3": "B/fXQk+jXRhOX4w0aTgipJhn7mQdMU6WV/Le/c+lUIQ=",
      "kind": "post",
      "refs": [
        "https://dana-prints.example/harbor",
        "pubky://pz6c7qywejnprcr9ixrscfpm88mxjxjx8kgpurk5qsx657i81mco/pub/pubky.app/files/0035R99S1P940"
      ],
      "seq": "4",
      "uri": "pubky://pz6c7qywejnprcr9ixrscfpm88mxjxjx8kgpurk5qsx657i81mco/pub/pubky.app/posts/0035R99S3KA80"
    },
    {
      "blake3": "drPQhK7MrotitRs4i8DD7Y/OEjB1Bu0SYJJqX0+ek5E=",
      "kind": "post",
      "seq": "5",
      "uri": "pubky://pz6c7qywejnprcr9ixrscfpm88mxjxjx8kgpurk5qsx657i81mco/pub/pubky.app/posts/0035R99S5GBC0"
    }
  ],
  "format": "slime-candidates/1",
  "provider": "7d6cn61a6xa6kfaq19bepdgb8w3zi9cudu7sm9xfcps9mb887nby",
  "query": {
    "key": "pz6c7qywejnprcr9ixrscfpm88mxjxjx8kgpurk5qsx657i81mco",
    "op": "author"
  }
}
