{
  "as_of": "2026-09-25T10:30:00Z",
  "complete": true,
  "entries": [
    {
      "kind": "tag",
      "label": "great-print",
      "refs": [
        "pubky://kq47ts1oghjief4acyjc7q8nuut5iodyw48atubb5d9h1gmoz1no/pub/slime-example/listings/print-2.json"
      ],
      "seq": "6",
      "sha256": "8221b438d4e800bc5490535c1418eec60106e5abd0d0109d3b61038d30a02fd2",
      "uri": "pubky://kr7c1ztn861wwgkg4ww3i815dyn38twdjrga6sgy9xru1pqepyuo/pub/slime-example/tags/print-2.json"
    }
  ],
  "format": "slime-candidates/1",
  "provider": "xow6mmo7j5her6boj1er4mdskyhsrzewr81iqqpk3bogyuq9o1io",
  "query": {
    "after": "5",
    "kind": "tag",
    "op": "refs",
    "uri": "pubky://kq47ts1oghjief4acyjc7q8nuut5iodyw48atubb5d9h1gmoz1no/pub/slime-example/listings/print-2.json"
  }
}
