{
  "as_of": "2026-09-25T09:30:00Z",
  "complete": true,
  "entries": [
    {
      "kind": "listing",
      "refs": [
        "pubky://kq47ts1oghjief4acyjc7q8nuut5iodyw48atubb5d9h1gmoz1no/pub/slime-example/shop.json"
      ],
      "seq": "2",
      "sha256": "99a2e249dcf6baf80b8deefe07a0851f54463b0bda5e13a0e09d5cb398d1e640",
      "uri": "pubky://kq47ts1oghjief4acyjc7q8nuut5iodyw48atubb5d9h1gmoz1no/pub/slime-example/listings/shirt-1.json"
    },
    {
      "kind": "listing",
      "refs": [
        "pubky://kq47ts1oghjief4acyjc7q8nuut5iodyw48atubb5d9h1gmoz1no/pub/slime-example/blobs/dc0a6bcfa8b224dadda57c997ec68bf786c1d2a6d479c958b52c12b8c0b44135",
        "pubky://kq47ts1oghjief4acyjc7q8nuut5iodyw48atubb5d9h1gmoz1no/pub/slime-example/shop.json"
      ],
      "seq": "5",
      "sha256": "f83c6058dec437d083a59df31009937129fece0f9b735c909ed64419a372d5a9",
      "uri": "pubky://kq47ts1oghjief4acyjc7q8nuut5iodyw48atubb5d9h1gmoz1no/pub/slime-example/listings/print-2.json"
    }
  ],
  "format": "slime-candidates/1",
  "provider": "pczjo5k55rbz55ceohtso7mrmbc74senpsthsrs9i7js6socbbpy",
  "query": {
    "key": "kq47ts1oghjief4acyjc7q8nuut5iodyw48atubb5d9h1gmoz1no",
    "kind": "listing",
    "op": "author"
  }
}
